{
  "id": "B.2.2",
  "description": "Selective Covered Components Using rsa-pss-sha512",
  "message": {
    "type": "request",
    "method": "POST",
    "url": "https://example.com/foo?param=Value&Pet=dog",
    "headers": [
      ["Host", "example.com"],
      ["Date", "Tue, 20 Apr 2021 02:07:55 GMT"],
      ["Content-Type", "application/json"],
      ["Content-Digest", "sha-512=:WZDPaVn/7XgHaAy8pmojAkGWoRx2UFChF41A2svX+TaPm+AbwAgBWnrIiYllu7BNNyealdVLvRwEmTHWXvJwew==:"],
      ["Content-Length", "18"]
    ],
    "body": "{\"hello\": \"world\"}"
  },
  "signingParams": {
    "label": "sig-b22",
    "components": [
      "@authority",
      "content-digest",
      {"name": "@query-param", "params": {"name": "Pet"}}
    ],
    "keyId": "test-key-rsa-pss",
    "algorithm": "rsa-pss-sha512",
    "created": 1618884473,
    "tag": "header-example"
  },
  "expectedBase": "\"@authority\": example.com\n\"content-digest\": sha-512=:WZDPaVn/7XgHaAy8pmojAkGWoRx2UFChF41A2svX+TaPm+AbwAgBWnrIiYllu7BNNyealdVLvRwEmTHWXvJwew==:\n\"@query-param\";name=\"Pet\": dog\n\"@signature-params\": (\"@authority\" \"content-digest\" \"@query-param\";name=\"Pet\");created=1618884473;keyid=\"test-key-rsa-pss\";tag=\"header-example\"",
  "expectedSignatureInput": "sig-b22=(\"@authority\" \"content-digest\" \"@query-param\";name=\"Pet\");created=1618884473;keyid=\"test-key-rsa-pss\";tag=\"header-example\"",
  "verifyOnlySignature": "LjbtqUbfmvjj5C5kr1Ugj4PmLYvx9wVjZvD9GsTT4F7GrcQEdJzgI9qHxICagShLRiLMlAJjtq6N4CDfKtjvuJyE5qH7KT8UCMkSowOB4+ECxCmT8rtAmj/0PIXxi0A0nxKyB09RNrCQibbUjsLS/2YyFYXEu4TRJQzRw1rLEuEfY17SARYhpTlaqwZVtR8NV7+4UKkjqpcAoFqWFQh62s7Cl+H2fjBSpqfZUJcsIk4N6wiKYd4je2U/lankenQ99PZfB4jY3I5rSV2DSBVkSFsURIjYErOs0tFTQosMTAoxk//0RoKUqiYY8Bh0aaUEb0rQl3/XaVe4bXTugEjHSw==",
  "deterministic": false,
  "keyFile": "keys/rsa-pss.priv.pem",
  "pubKeyFile": "keys/rsa-pss.pub.pem"
}
