{
  "id": "B.2.1",
  "description": "Minimal Signature Using rsa-pss-sha512",
  "message": {
    "type": "request",
    "method": "POST",
    "url": "https://example.com/foo?param=Value&Pet=dog",
    "headers": [
      ["Host", "example.com"],
      ["Date", "Tue, 20 Apr 2021 02:07:55 GMT"],
      ["Content-Type", "application/json"],
      ["Content-Digest", "sha-512=:WZDPaVn/7XgHaAy8pmojAkGWoRx2UFChF41A2svX+TaPm+AbwAgBWnrIiYllu7BNNyealdVLvRwEmTHWXvJwew==:"],
      ["Content-Length", "18"]
    ],
    "body": "{\"hello\": \"world\"}"
  },
  "signingParams": {
    "label": "sig-b21",
    "components": [],
    "keyId": "test-key-rsa-pss",
    "algorithm": "rsa-pss-sha512",
    "created": 1618884473,
    "nonce": "b3k2pp5k7z-50gnwp.yemd"
  },
  "expectedBase": "\"@signature-params\": ();created=1618884473;keyid=\"test-key-rsa-pss\";nonce=\"b3k2pp5k7z-50gnwp.yemd\"",
  "expectedSignatureInput": "sig-b21=();created=1618884473;keyid=\"test-key-rsa-pss\";nonce=\"b3k2pp5k7z-50gnwp.yemd\"",
  "verifyOnlySignature": "d2pmTvmbncD3xQm8E9ZV2828BjQWGgiwAaw5bAkgibUopemLJcWDy/lkbbHAve4cRAtx31Iq786U7it++wgGxbtRxf8Udx7zFZsckzXaJMkA7ChG52eSkFxykJeNqsrWH5S+oxNFlD4dzVuwe8DhTSja8xxbR/Z2cOGdCbzR72rgFWhzx2VjBqJzsPLMIQKhO4DGezXehhWwE56YCE+O6c0mKZsfxVrogUvA4HELjVKWmAvtl6UnCh8jYzuVG5WSb/QEVPnP5TmcAnLH1g+s++v6d4s8m0gCw1fV5/SITLq9mhho8K3+7EPYTU8IU1bLhdxO5Nyt8C8ssinQ98Xw9Q==",
  "deterministic": false,
  "keyFile": "keys/rsa-pss.priv.pem",
  "pubKeyFile": "keys/rsa-pss.pub.pem"
}
